title,link,description,pubDate,processed_pubdate,full_article1,full_article2,time_zone
UBS Seeks Swiss Backstop in Any Credit Suisse Deal,https://www.moneycontrol.com/news/business/ubs-seeks-swiss-backstopany-credit-suisse-deal_16931451.html,"<img src=""https://www.moneycontrol.com/news_image_files/2017/200x200/j/jobs_hiring_1280_200.jpg"" alt=""More job openings in tourism, advertising and PR as sectors in post-COVID revival mode"" title=""More job openings in tourism, advertising and PR as sectors in post-COVID revival mode"" border=""0"" width=""75"" height=""75"" align="" left"" hspace=""5""/> The two sectors saw a double-digit growth in hiring activity in January this year compared to last year. While travel is seeing increase in demand amid travellers which is leading to travel firms expanding their team, many companies are increasing their marketing budget resulting in PR and marketing firms hiring new talent.","Sat, 18 Mar 2023 17:58:10 +0530",2023-03-18 12:28:10,"Representative image  live bse live  nse live Volume Todays L/H More ×  Job openings have increased across travel and tourism, and advertising and public relations (PR) firms as these industries are in a revival phase after two years of dealing with the impact of Covid-19-led challenges.  The two sectors saw a 15 percent uptick in hiring activity in January this year compared to last year, according to data from foundit, an employment search service.  ""Advertising and PR saw a 6 percent growth in hiring activity in January 2023 when compared to December 2022 and 15 percent on a year-on-year basis, while travel/tourism saw a 5 percent upsurge on a month-on-month basis and 15 percent on an annual basis. Both industries have made large contributions towards employment growth in January 2023 and have emerged in top three list on an annualised basis,"" said Sekhar Garisa, CEO, foundit (previously Monster).  In the aftermath of the pandemic, the revival of the travel and tourism industry has boomed, an effect of what has been termed “revenge travel”. Rikant Pittie, co-founder, EaseMyTrip, said, ""Air India has hired over 1,900 cabin crew between May 2022 and Feb 2023. Similarly, over 1,100 cabin crew members were trained in the last seven months. Several other airlines have begun expanding their capacity and fleets to meet the rising demand. EaseMyTrip is also expanding and we expect to grow our workforce in the coming fiscal year.”  Dussehra, Diwali see spike in travel demand; hotels expect 80% occupancy in festive period  At least one other company in the travel space is looking to expand its staff strength.  ""We are actively seeking new talent to join the team. We have seen a surge in demand for our services. To meet this demand, we are expanding our team across various functions, including sales, customer service, marketing, operations and technology,"" said A Krishna Mohan, managing director, Southern Travels.  Job roles  “Top job roles in the travel and tourism segment include travel consultants that made up 15 percent of positions offered in January 2023 whereas customer service executives had a share of 11 percent of total positions offered, followed by roles in products and technology with a share of 8 percent,"" said Garisa.  For advertising and PR, the top roles in demand are those in digital marketing with a share of 24 percent of the total in the industry, research analysts at 24 percent and content specialists at 29 percent.  Cleartrip CEO Ayyappan R: No one expected this kind of resurgence in travel demand  Garisa added that the hiring is largely driven by airline companies along with emerging OTA (online travel operators) platforms in the travel and tourism sector, whereas in the advertising and PR industry, the demand is seen largely in market research companies.  Agencies dealing with SEO or search engine optimisation, online reputation management, media planning and influencer marketing for their clients are likely to invest more in improving the skills of their current workforce, or hiring new talent with relevant skills, said Michell Anthony, director, human resources, at Blink Digital, an ad agency. The company that has also been actively hiring said that there has been an increase in demand for social media managers, media planners and content creators in the advertising and marketing sector.  ""Additionally, due to the emergence of AI (artificial intelligence) and the rise of targeted marketing, the demand for professionals with technical expertise in Web3, such as data engineers, data analysts and data scientists is also increasing significantly,"" she added.  For instance, PR company Value 360 Communications is looking to hire around 100 new professionals this year. ""We are hiring at a steady pace,"" said Kunal Kishore Sinha, founder and director.  Rang barse on beaches, at spiritual destinations: Travel demand sees","uptick this Holi  Madchatter Brand Solutions is expanding its team to cater to increasing business opportunities. ""2023 will see a significant increase in hiring within the PR industry due to expected brand spends on marketing and PR at large,"" said Rachna Baruah, founder of the communications firm.  In the past few months, there has been massive hiring taking place within the ad industry, said Sonam Shah, founder and CEO, Treize Communications.  ""After three years of slowdown, companies are now in a better shape to spend on marketing. This means ad agencies will have to keep more team members and support teams to meet end-moment demands. We are also hiring, from interns to mid-level associates, and expect to increase our team by more than double by the end of this year. We will see a spike during the festive season, as brands will pump in money for marketing campaigns,"" she added.  City-wise hiring trends  Foundit data also highlighted location trends that showed Kochi reporting the highest increase in job postings in the travel and tourism segment with 47 percent growth in January followed by Chandigarh at 29 percent and Chennai at 25 percent on a year-on-year basis.  India's travel and tourism to post annual growth rate of over 10 percent in 2019-28, says IBEF report  For advertising and PR, Delhi/NCR, Chennai and Bengaluru recorded 57 percent, 51 percent and 16 percent growth, respectively, over the last year.  ""The pace of recruitment growth is moderate as employers continue to exhibit a cautious approach owing to the challenging economic environment. However, there are pockets of elevated demand that suggest relatively favourable conditions in certain industry sectors such as retail, travel and tourism and advertising, market research and the PR sector. Travel and tourism, advertising and PR have reflected continuous growth since last year and strong optimism to hire has led to the overall growth in the recruitment landscape,"" said Garisa.",UTC
"More job openings in tourism, advertising and PR as sectors in post-COVID revival mode",https://www.moneycontrol.com/news/business/more-job-openingstourism-advertisingpr-as-sectorspost-covid-revival-mode_16930821.html,"<img src=""https://www.moneycontrol.com/news_image_files/2017/200x200/j/jobs_hiring_1280_200.jpg"" alt=""More job openings in tourism, advertising and PR as sectors in post-COVID revival mode"" title=""More job openings in tourism, advertising and PR as sectors in post-COVID revival mode"" border=""0"" width=""75"" height=""75"" align="" left"" hspace=""5""/> The two sectors saw a double-digit growth in hiring activity in January this year compared to last year. While travel is seeing increase in demand amid travellers which is leading to travel firms expanding their team, many companies are increasing their marketing budget resulting in PR and marketing firms hiring new talent.","Fri, 17 Mar 2023 14:25:37 +0530",2023-03-17 08:55:37,"Boeing Co. and Airbus SE are increasingly looking to India for highly-skilled, low-cost engineers to meet a boom in demand for aircraft and expand their manufacturing presence in the world’s fifth-largest economy.  Airbus plans to hire 1,000 people in India this year out of 13,000 globally. Boeing and its suppliers, which already employ about 18,000 workers in the nation, have been growing by some 1,500 staff every year, the US jet manufacturer’s India head Salil Gupte told Bloomberg News in an interview.  With about 1.5 million engineering students graduating annually, India is a rich source of talent for planemakers facing record orders from airlines as travel surges again after the Covid pandemic. Boeing can hire an engineer in Bengaluru, India’s southern tech hub, for 7% of the cost of a similar role in Seattle, according to salary data compiler Glassdoor.  The country has Boeing’s second-biggest workforce worldwide, Gupte said.  “Companies come to India for the incredible talent in innovation, not just in technology and software, but also in hard engineering and increasingly in manufacturing,” he said at the Aero India show in Bengaluru last month.  Alongside the hiring push, Boeing and Airbus are also establishing some production in India, which is pitching itself as a less politically fraught alternative to China.  Boeing signed a partnership with GMR Aero Technic Ltd. on March 10 to convert passenger jets to freighters in the southern Indian city of Hyderabad, where it already has a facility making vertical fins, which stabilize planes. The plant, employing over 900 engineers and technicians, also produces Boeing AH-64 Apache helicopter structures, including fuselages for customers worldwide.  Airbus has also been touting India’s manufacturing prospects as it hires in the country. In October, Prime Minister Narendra Modi attended a ceremony in his home state of Gujarat to mark the start of construction of a facility where Airbus Defence & Space SA and a unit of local conglomerate Tata Group will make C-295 transport aircraft for the Indian military.  The nation is an emerging market for sales, with the revitalized Air India Ltd. making a blockbuster order for 470 aircraft last month, split between the planemakers.  “The time is right for India to turn into an international hub,” Airbus Chief Executive Officer Guillaume Faury said at the time of the aircraft order. “India is well on its way.”  A vast pool of educated, English-speaking talent adds to India’s appeal as a hiring ground.  Airbus employs more than 700 people at an engineering center in Bengaluru, and over 150 others in customer services there as well as in the capital New Delhi. India has a “unique ability” to support the company with its skilled manpower, an Airbus representative told Bloomberg, adding that hiring in the country was “not really” coming at the cost of jobs in other locations.  A Boeing representative said the planemaker leverages India’s talent for engineering, technology and research and development. The company has said it plans to hire 10,000 people globally this year after adding nearly 15,000 in 2022, with a focus on engineering and manufacturing.  Still, the Seattle Times reported last month that Boeing will cut about 2,000 jobs, mainly in finance and human resources, but without specifying where. Some of those jobs are being outsourced to Tata’s consulting arm in India.  Gupte defended Boeing’s focus on India hiring, saying a bigger workforce there will help increase jobs in the US. Expanding manufacturing and innovation capabilities in the country will attract more customers and drive up demand for Boeing’s products, spurring employment, he said.  Boeing tests some of its latest manufacturing technologies in India before rolling them out in US factories, which helps improve production efficiency, according to Gupte, who is based in","Delhi.  Boeing said in February it is investing 2 billion rupees ($24 million) in a logistics park in India that will initially cater to local airlines and then a larger network of customers in the region. The planemaker will also set up a support center with dozens of employees for airlines near Delhi.  Companies have for decades looked to India to outsource jobs, from trade settlement to travel bookings. The country is home to about 40% of so-called global capability centers that provide tech, engineering and IT support, according to HSBC Holdings Plc. More recently, there’s been a shift to higher-skilled work for multinationals, including research and business development.  The availability of workers in India at “competitive global costs makes offshoring of certain production processes a very real possibility,” said Ravi Srivastava, director of the Center For Employment Studies at the Institute of Human Development in Delhi.  Israel Aerospace Industries, which has worked with partners in India for three decades on air and missile defense systems, drones, satellites and other equipment, is among companies in the sector joining the hiring spree.  “I’m amazed by the talent you find here in India. We are hiring new talent all the time,” Danny Lauber, chief executive officer of Israel Aerospace’s India unit, said in an interview. “I have worked in many places around the world, but I haven’t seen such a strong universe of resources.”",UTC
GAIL signs pact with Shell to explore ethane sourcing,https://www.moneycontrol.com/news/business/gail-signs-pactshell-to-explore-ethane-sourcing_16930681.html,"<img src=""https://www.moneycontrol.com/news_image_files/2023/200x200/3/3-air-india-boeing-airbus-deal_200.jpg"" alt=""Boeing and Airbus intensify search for skilled talent in India"" title=""Boeing and Airbus intensify search for skilled talent in India"" border=""0"" width=""75"" height=""75"" align="" left"" hspace=""5""/> Airbus plans to hire 1,000 people in India this year out of 13,000 globally. Boeing and its suppliers, which already employ about 18,000 workers in the nation, have been growing by some 1,500 staff every year, the US jet manufacturerâs India head Salil Gupte told Bloomberg News in an interview.","Fri, 17 Mar 2023 13:21:05 +0530",2023-03-17 07:51:05,"In his recorded statement before the magistrate, one of NIA’s protected key witnesses, who was once a member of the core team of the Popular Front of India (PFI), has claimed that all arrested members of banned outfit were taught that in case of any disturbance from Pakistan, the Indian Army would be busy in the North and with PFI’s training they can capture South India and move towards the North, the probe agency has said in its chargesheet, filed in a Delhi court.  The chargesheet, filed against 19 senior leaders of PFI in connection with criminal conspiracy aimed at destabilising and dismembering the country, says that under the garb of a socio-political movement, PFI was putting together a “highly motivated, trained and secretive elite force to achieve its violent long-term objective of establishment of Islamic rule in India by 2047”.  The NIA, which last year raided 39 premises associated with PFI and arrested scores of office-bearers of the group, arraigned 19 people as accused, including 12 national executive council (NEC) members, founding members and senior leaders of PFI. The NEC is PFI’s top decision-making arm.  The PFI as an organisation has also been chargesheeted in the case. Among those named in it are PFI chairman O M A Salam, vice-chairman E M Abdul Rahiman, national secretary V P Nazaruddin, and NEC national general secretary Anees Ahmed.  In their chargesheet, the investigation officer (IO) said that detailed examination of protected witnesses has revealed that the PFI had devised strategies to implement their long-term goal of establishing an Islamic Caliphate by overthrowing the democratically elected government through armed rebellion. “One of the protected witnesses said that in Tharbiyath sessions held by the accused, it was mentioned that in case of any disturbance from Pakistan, the Indian Army would be busy in the North, and with PFI’s training they could capture the South and move towards the North. This indicates PFI’s intention of waging war against India and to overthrow the democratically established government,” the chargesheet said.  Also Read | Kerala HC quashes order by Governor on varsity  “PFI was secretly recruiting men and organising arms training across the country to raise an ‘army’ willing and ready to wage war against the central government,” according to the chargesheet. “One of the key elements of their planned strategy was to mark important leaders of organisations which disapprove (of) PFI’s ideology, including Hindu organisations. They made their profiling and [planned to] assassinate them through their hit squads/service teams to create communal wedge between the communities.”  During investigation, the NIA downloaded videos from PFI’s official accounts in YouTube and found that the accused persons, who are its NEC members, could be clearly seen addressing large gatherings of people. “They were provoking them against the central government by wrongful interpretations of government policies to create hatred against the entire state machinery, High Courts and the Supreme Court and instigating the crowd towards violence against the persons belonging to a particular religious or political group,” the chargesheet states.  Advertisement  “It was observed in one of the videos that OMA Salam has been exhorting Muslims not to forget the Babri Masjid issue, and claiming that they did not get justice even from the Supreme Court,” the NIA has stated. “He called upon Muslims to keep fighting and this was intended to provoke their religious sentiments on an issue which has been judicially settled by the Apex Court of the country.”  “NEC members of PFI were found to be involved in arranging funds for organising arms training camps, purchase of weapons and targeted killings. Since the outfit was formed in 2006, PFI cadres have been involved in a series of murders and violent attacks in the","country, including those of leaders of organisations who are at variance with the PFI on religious ideas and beliefs,” the NIA said in a statement.",UTC
